{
  "$schema": "https://json-schema.org/draft/2020-12/schema",
  "$id": "https://turbonet.example/schemas/webrtc-acceptance/manifest-v2.json",
  "title": "TurboMedia WebRTC acceptance manifest v2",
  "type": "object",
  "additionalProperties": false,
  "required": ["schema_version", "profile", "source", "grid", "sfu", "turn", "topologies", "scenarios", "phase_deadlines", "threshold_profile", "artifact_directory"],
  "properties": {
    "schema_version": { "const": 2 },
    "profile": { "enum": ["diagnostic", "release", "contract_lab"] },
    "source": {
      "type": "object",
      "additionalProperties": false,
      "required": ["commit", "require_clean_tree", "test_page_url", "test_page_sha256"],
      "properties": {
        "commit": { "type": "string", "pattern": "^[0-9a-f]{40}$" },
        "require_clean_tree": { "type": "boolean" },
        "test_page_url": { "type": "string", "minLength": 1 },
        "test_page_sha256": { "type": "string", "pattern": "^[0-9a-f]{64}$" }
      }
    },
    "grid": {
      "type": "object",
      "additionalProperties": false,
      "required": ["endpoint_env", "browsers"],
      "properties": {
        "endpoint_env": { "type": "string", "minLength": 1 },
        "browsers": {
          "type": "array",
          "minItems": 1,
          "$comment": "limits:maxItems=MAX_CASES",
          "items": {
            "type": "object",
            "additionalProperties": false,
            "required": ["name", "version", "platform"],
            "properties": {
              "name": { "type": "string", "minLength": 1 },
              "version": { "type": "string", "minLength": 1 },
              "platform": { "type": "string", "minLength": 1 }
            }
          }
        }
      }
    },
    "sfu": {
      "type": "object",
      "additionalProperties": false,
      "required": ["base_url", "whip_endpoint", "whep_endpoint", "token_provider"],
      "properties": {
        "base_url": { "type": "string", "minLength": 1 },
        "whip_endpoint": { "type": "string", "minLength": 1 },
        "whep_endpoint": { "type": "string", "minLength": 1 },
        "token_provider": { "$ref": "#/$defs/command" }
      }
    },
    "turn": {
      "type": "object",
      "additionalProperties": false,
      "required": ["credential_provider"],
      "properties": {
        "credential_provider": { "$ref": "#/$defs/command" }
      }
    },
    "topologies": {
      "type": "array",
      "minItems": 1,
      "$comment": "limits:maxItems=MAX_CASES",
      "items": {
        "type": "object",
        "additionalProperties": false,
        "required": ["topology_id", "relay_contract", "hooks"],
        "properties": {
          "topology_id": { "type": "string", "minLength": 1 },
          "relay_contract": { "$ref": "#/$defs/relay_contract" },
          "hooks": {
            "type": "object",
            "additionalProperties": false,
            "required": ["setup", "transition", "teardown"],
            "properties": {
              "setup": { "$ref": "#/$defs/command" },
              "transition": { "$ref": "#/$defs/command" },
              "teardown": { "$ref": "#/$defs/command" },
              "probe": { "$ref": "#/$defs/command" }
            }
          }
        }
      }
    },
    "scenarios": {
      "type": "array",
      "minItems": 1,
      "$comment": "limits:maxItems=MAX_CASES",
      "items": {
        "type": "object",
        "additionalProperties": false,
        "required": ["scenario_id", "topology_id", "workflow", "sample_interval_ms", "duration_ms"],
        "properties": {
          "scenario_id": { "type": "string", "minLength": 1 },
          "topology_id": { "type": "string", "minLength": 1 },
          "workflow": {
            "type": "object",
            "additionalProperties": false,
            "required": ["credential_expiry", "topology_transition"],
            "properties": {
              "credential_expiry": { "type": "boolean" },
              "topology_transition": { "type": "boolean" }
            },
            "allOf": [{
              "if": {
                "properties": { "credential_expiry": { "const": true } },
                "required": ["credential_expiry"]
              },
              "then": { "properties": { "topology_transition": { "const": true } } }
            }]
          },
          "sample_interval_ms": { "type": "integer", "$comment": "limits:minimum=MIN_SAMPLE_INTERVAL_MS;maximum=MAX_CASE_DURATION_MS" },
          "duration_ms": { "type": "integer", "minimum": 1, "$comment": "limits:maximum=MAX_CASE_DURATION_MS" }
        }
      }
    },
    "phase_deadlines": {
      "type": "object",
      "additionalProperties": false,
      "required": ["preflight_ms", "connect_ms", "stable_ms", "transition_ms", "recovery_ms", "drain_ms"],
      "properties": {
        "preflight_ms": { "$ref": "#/$defs/duration" },
        "connect_ms": { "$ref": "#/$defs/duration" },
        "stable_ms": { "$ref": "#/$defs/duration" },
        "transition_ms": { "$ref": "#/$defs/duration" },
        "recovery_ms": { "$ref": "#/$defs/duration" },
        "drain_ms": { "$ref": "#/$defs/duration" }
      }
    },
    "threshold_profile": {
      "type": "object",
      "additionalProperties": false,
      "required": ["profile_id", "stable", "recovery", "drain"],
      "properties": {
        "profile_id": { "type": "string", "minLength": 1 },
        "stable": { "$ref": "#/$defs/thresholds" },
        "recovery": { "$ref": "#/$defs/thresholds" },
        "drain": { "$ref": "#/$defs/thresholds" }
      }
    },
    "artifact_directory": { "type": "string", "minLength": 1 },
    "limits": {
      "type": "object",
      "additionalProperties": false,
      "properties": {
        "max_cases": { "type": "integer", "minimum": 1, "$comment": "limits:maximum=MAX_CASES" },
        "max_provider_output_bytes": { "type": "integer", "minimum": 1, "$comment": "limits:maximum=MAX_PROVIDER_OUTPUT_BYTES" },
        "max_hook_output_bytes": { "type": "integer", "minimum": 1, "$comment": "limits:maximum=MAX_HOOK_OUTPUT_BYTES" },
        "max_case_log_bytes": { "type": "integer", "minimum": 1, "$comment": "limits:maximum=MAX_CASE_LOG_BYTES" },
        "max_samples_per_case": { "type": "integer", "minimum": 1, "$comment": "limits:maximum=MAX_SAMPLES_PER_CASE" },
        "max_artifact_bytes_per_case": { "type": "integer", "minimum": 1, "$comment": "limits:maximum=MAX_ARTIFACT_BYTES_PER_CASE" }
      }
    }
  },
  "$defs": {
    "command": {
      "type": "object",
      "additionalProperties": false,
      "required": ["command"],
      "properties": {
        "command": {
          "type": "array",
          "minItems": 1,
          "$comment": "limits:maxItems=MAX_CASES",
          "items": { "type": "string", "minLength": 1 }
        }
      }
    },
    "relay_contract": {
      "type": "object",
      "additionalProperties": false,
      "required": ["schema_version", "ip_family", "protocol", "relay_protocol", "remote_candidate_types"],
      "properties": {
        "schema_version": { "const": 1 },
        "ip_family": { "enum": ["ipv4", "ipv6"] },
        "protocol": { "enum": ["udp", "tcp"] },
        "relay_protocol": { "enum": ["udp", "tcp", "tls"] },
        "remote_candidate_types": {
          "type": "array",
          "minItems": 1,
          "maxItems": 4,
          "uniqueItems": true,
          "items": { "enum": ["host", "srflx", "prflx", "relay"] }
        }
      }
    },
    "duration": { "type": "integer", "minimum": 1, "$comment": "limits:maximum=MAX_CASE_DURATION_MS" },
    "thresholds": {
      "type": "object",
      "additionalProperties": false,
      "properties": {
        "minimum_samples": { "type": "integer", "minimum": 1, "$comment": "limits:maximum=MAX_SAMPLES_PER_CASE" },
        "maximum_duration_ms": { "$ref": "#/$defs/duration" },
        "max_sample_gap_ms": { "$ref": "#/$defs/duration" },
        "max_rtt_ms": { "type": "number", "minimum": 0 },
        "max_jitter_ms": { "type": "number", "minimum": 0 },
        "max_loss_ratio": { "type": "number", "minimum": 0, "maximum": 1 },
        "min_media_delta": { "type": "integer", "minimum": 0 },
        "max_drain_duration_ms": { "$ref": "#/$defs/duration" }
      }
    }
  }
}
